{
  "schema_version": "1",
  "request_id": "00000000-0000-4000-8000-000000000003",
  "model": {
    "model_id": "example/paired-encoder",
    "revision": "1111111111111111111111111111111111111111",
    "artifact_digest": "2222222222222222222222222222222222222222222222222222222222222222",
    "preprocessing_digest": "3333333333333333333333333333333333333333333333333333333333333333",
    "dimensions": 3
  },
  "task": "text_embedding",
  "scope_id": "00000000-0000-4000-8000-000000000002",
  "text": "a red square on a white background"
}
